LogicalName,DisplayName,PluralName,Ownership,Audit,Solution,Purpose,DynamicsAlignment,AlternateKeys
ccsb_resourcecapability,Resource Capability,Resource Capabilities,UserOwned,Enable table and column audit for all business fields.,CCSB Foundation Schema v1.1 proposed,"Normalized resource skill, certification, clearance, category, territory, facility feature, or capacity capability used by eligibility and requirement rules.","Maps to Field Service bookable resource characteristics, resource categories, territories, and proficiency/rating concepts while remaining product-owned and optional when Field Service is not installed.",ccsb_ResourceCapability_Key: ccsb_capabilitykey
ccsb_operationaudit,Operation Audit,Operation Audits,UserOwned,Enable Dataverse audit and also enforce append-only CCSB audit semantics.,CCSB Foundation Schema v1.1 proposed,"Append-only product audit evidence for commands, validations, security decisions, confirmations, publishes, rollbacks, support reads, and integration transitions.","Complements Dataverse auditing and plug-in trace data with product-scoped operation, reason, policy, correlation, and before/after evidence.",ccsb_OperationAudit_Key: ccsb_auditkey
ccsb_schedulechange,Schedule Change,Schedule Changes,UserOwned,Enable table and column audit; enforce append-only or state-forward-only transitions.,CCSB Foundation Schema v1.1 proposed,"Controlled ledger of proposed, committed, published, superseded, or rolled-back schedule mutations.","Maps to changes that would otherwise be made directly to bookings, assignments, or requirements in Field Service/Project Operations. CCSB keeps the ledger product-owned so all mutations flow through Custom APIs.",ccsb_ScheduleChange_Key: ccsb_changekey
ccsb_publishsnapshotitem,Publish Snapshot Item,Publish Snapshot Items,OrganizationOwned,Enable audit; update/delete denied except system archive process.,CCSB Foundation Schema v1.1 proposed,Immutable item-level evidence for every record/field included in a publish or rollback snapshot.,Complements ccsb_publishsnapshot header and avoids storing all official-state evidence only in a large JSON manifest. No direct Field Service table equivalent.,ccsb_PublishSnapshotItem_Key: ccsb_snapshotitemkey
ccsb_publishlock,Publish Lock,Publish Locks,UserOwned,Enable audit; update allowed only through lock/unlock/override APIs.,CCSB Foundation Schema v1.1 proposed,Protected scope that blocks or governs edits against official/published schedule state.,"No direct URS table equivalent. This is CCSB's product-owned concurrency and release-governance lock, similar in spirit to approval/booking-status protection but explicit and queryable.",ccsb_PublishLock_Key: ccsb_lockkey
ccsb_outboxevent,Outbox Event,Outbox Events,OrganizationOwned,Enable audit for status and error fields; payload fields field-secured.,CCSB Foundation Schema v1.1 proposed,"Durable transactional outbox event reserved for integration, connector, export, notification, and downstream delivery after CCSB state commits.",Generic Dataverse/enterprise outbox pattern. V1 should persist events but keep delivery disabled unless a governed connector capability is activated.,ccsb_OutboxEvent_Key: ccsb_eventkey
